<?xml version = '1.0'?>
<?xml-stylesheet type="text/xsl" href="../xslt/jadepunk_html.xsl"?>
<!DOCTYPE jadepunk SYSTEM "../jadepunk.dtd">
<character>
 <id>
  <charname>Taia Kwan</charname>
  <playername>sample Jadepunk character</playername>
  <story>
   When Taia was a young girl she witnessed a martial arts duel. Inspired by
   what she saw, she has dedicated her life to the mastery of the martial arts,
   illegal or not. The Governor be damned.
  </story>
 </id>
 <refresh>3</refresh>
 <current-fate-points>3</current-fate-points>
 <aspects>
  <aspect type="Portrayal">Youthful Martial Arts Master</aspect>
  <aspect type="Background">I Grew Up On the Streets of Kausao City</aspect>
  <aspect type="Inciting-Incident">Witnessed a Martial Arts Duel</aspect>
  <aspect type="Belief">I Have Sacrificed Too Much to Stop Now</aspect>
  <aspect type="Trouble">Never Able to Cut Loose</aspect>
 </aspects>
 <professions>
  <profession rating="0" name="Aristocrat"/>
  <profession rating="1" name="Engineer"/>
  <profession rating="2" name="Explorer"/>
  <profession rating="3" name="Fighter"/>
  <profession rating="1" name="Scholar"/>
  <profession rating="2" name="Scoundrel"/>
 </professions>
 <assets>
  <asset cost="2" function="Green Jade Tattoo of Protection" name="Jade Tattoo" type="Device">
   <features>
    <feature effect="1" type="Protective"/>
    <feature effect="2" type="Sturdy"/>
   </features>
   <flaws>
    <flaw type="Troubling" effect="Easily Identifiable"/>
   </flaws>
  </asset>
  <asset cost="1" function="My Mentor's Sword" name="Jian Longsword" type="Device">
   <features>
    <feature effect="2" type="Harmful"/>
   </features>
   <flaws>
    <flaw type="Troubling" effect="It's Illegal to Own a Guardsman's Blade"/>
   </flaws>
  </asset>
  <asset cost="1" guiding-aspect="Portrayal" name="Jirai Mastery" type="Technique">
   <features>
    <feature type="Focus" effect="Fighter +2"/>
   </features>
   <flaws>
    <flaw type="Situational" effect="Only When Wielding a Jian Longsword"/>
   </flaws>
  </asset>
 </assets>
 <consequences>
  <consequence severity="Mild">mild one</consequence>
 </consequences>
</character>
