<?xml version="1.0" encoding="utf8"?>
<?xml-stylesheet type="text/xsl" href="../../xslt/jadepunk_html.xsl"?>
<!DOCTYPE jadepunk SYSTEM "jadepunk.dtd">
<character>
  <id>
    <charname>Jaron Reis</charname>
    <playername>sample Jadepunk character</playername>
    <story>
      Jaron murdered a man to get his position on the Council, giving him a bad
      reputation and a lot of guilt. He has since joined the Jianghu (江湖; lit.
      "rivers and lakes"), and uses his resources and power to assist them.
    </story>
  </id>
  <refresh>3</refresh>
  <current-fate-points>3</current-fate-points>
  <aspects>
    <aspect type="Portrayal">Councilor of the 江湖</aspect>
    <aspect type="Background">Naramel Representative on the Council of Nine</aspect>
    <aspect type="Inciting-Incident">Committed Murder in the Name of the Council</aspect>
    <aspect type="Belief">No One Should Have Absolute Power</aspect>
    <aspect type="Trouble">Secretly in Debt</aspect>
  </aspects>
  <professions>
    <profession rating="+3" name="Aristocrat"/>
    <profession rating="+1" name="Engineer"/>
    <profession rating="+1" name="Explorer"/>
    <profession rating="0" name="Fighter"/>
    <profession rating="+2" name="Scholar"/>
    <profession rating="+2" name="Scoundrel"/>
  </professions>
  <assets>
    <asset cost="2" function="White Jade Airship" name="Airship" type="Device">
      <features>
        <feature type="Aspect" effect="江湖 crew"/>
        <feature type="Exceptional" effect="Instantly leave or appear in a scene, as long as there's a way in or out"/>
      </features>
      <flaws>
        <flaw type="Consuming"/>
        <flaw type="Demanding" effect="Requires a Fair [+2] Explorer roll to get a ship underway"/>
      </flaws>
    </asset>
    <asset cost="1" guiding-aspect="Background" name="Councilor's Perks" type="Technique">
      <features>
        <feature type="Flexible" effect="Roll Aristocrat instead of Engineer"/>
      </features>
      <flaws>
        <flaw type="Situational" effect="Only when creating temporary Device assets"/>
      </flaws>
    </asset>
    <asset cost="1" guiding-aspect="Portrayal" name="Ear to the Ground" type="Technique">
      <features>
        <feature type="Focus" effect="Aristocrat +2"/>
      </features>
      <flaws>
        <flaw type="Situational" effect="Only when using your network to find information"/>
      </flaws>
    </asset>
  </assets>
  <consequences/>
</character>
